commit	experiment	depth_0_pct	ov_cos_pct	warp_pct	depth_gt_pct	status	description
cf1417f	ar_mar21_002	-7.1	-19.2	-16.5	-4.2	keep	MOTION HEAD + BEV FLOW SUPERVISION: motion_warp=1.0+motion_flow=0.5+[10K,2K,4K]+all improvements. BEV similarity pseudo-labels supervise motion_head to predict dynamic object displacement.
b07120b	ar_mar21_003	-7.0	-20.0	-16.5	-4.1	keep	DYNAMIC MOTION WARP (no auto-mask): motion_warp=1+dyn_motion_warp=1+[10K,2K,4K]+all. Direct L1 loss on dynamic pixels without identity auto-masking. Breaks chicken-and-egg for motion head training.
72ffc2b	ar_mar21_004	-7.3	-18.4	-16.5	-4.7	keep	NON-DETACHED motion head + dyn_motion_warp=2.0: gradient flows to decoder features. Hypothesis: richer features enable motion learning. Watch for depth_0/ov_cos regression from feature corruption.
4dceec1	ar_mar21_005	-6.6	-17.4	-14.5	-1.9	keep	TEMPORAL DEPTH CONSISTENCY: temporal_depth=1.0+[10K,2K,4K]+all improvements. SiLog loss between projected Gaussian depth and past-frame foundation depth. Direct geometric temporal signal.
7aeba97	ar_mar21_006	-5.2	-18.9	-15.7	-2.2	keep	BASELINE with latest code: [10K,2K,4K]+df=1.2+dgt=0.4+ov_warp=3.0 (no motion/temporal_depth). Clean reference for SelfOccFlow comparison.
fd20ac3	ar_mar21_007	-6.7	-17.6	-14.4	-2.6	keep	MEMORY BANK MERGE: past static Gaussians merged with current for denser warp depth. Phase 3 SelfOccFlow — true temporal aggregation with ego-motion transformed past Gaussians.
63825c7	ar_mar21_008	-5.2	-10.7	-10.5	+0.2	keep	MEMORY BANK + 14K Gaussians (3 GPUs): [8000,2000,4000]+use_memory_bank+all improvements. Tests memory bank with smaller total Gaussians on 3 GPUs.
63825c7	ar_mar21_009	-12.2	-12.6	-9.7	-7.8	keep	MEMORY BANK + [8000,2000,4000] + 4 GPUs + all improvements: tests memory bank at 14K Gaussians which completes within timeout. Compare with ar_mar19_014 (no bank, same config).
ce2d310	ar_mar21_010	-12.7	-11.8	-9.6	-7.7	keep	MEMORY BANK 4 frames: tests if more temporal history helps. ar_mar21_009 (2 frames) gave depth_0=0.4233. Does 4 frames improve further?
52c68ba	ar_mar21_011	-6.6	-17.1	-14.4	-2.7	keep	ULTIMATE: memory_bank(4 frames)+[10K,2K,4K]+df=1.2+dgt=0.4+ov_warp=3.0. Previous 16K best without bank: depth_0=0.4196. With bank: ?
ebc7a40	ar_mar21_012	-12.0	-12.6	-9.6	-7.2	keep	REPRODUCIBILITY: same as ar_mar21_009 (memory bank, 14K, 4 GPUs). Check if depth_0=0.4233 is reproducible.
a6da47c	ar_mar21_013	-12.2	-12.1	-9.6	-8.0	keep	MEMORY BANK ALL LEVELS: merge past Gaussians at all 3 decoder levels (was coarsest only). ar_mar21_009 (coarsest only): depth_0=0.4233. All levels: ?
9f3afca	ar_mar21_014	-12.6	-12.0	-9.6	-7.5	keep	TUNED MEMORY BANK: threshold=0.3 (was 0.6), decay=0.9 (was 0.8). More past Gaussians with higher contribution. ar_mar21_009 baseline: depth_0=0.4233.
e8f449f	ar_mar21_015	-11.6	-11.4	-9.7	-7.7	keep	MEMORY BANK + dyn=2.0: stronger dynamic losses with bank. Earlier dyn=2.0 hurt at 10K without bank. With bank providing static coverage, can stronger dyn help?
52a5457	ar_mar21_016	-12.2	-12.7	-9.6	-7.7	keep	MEMORY BANK + ov_cos-optimal config (df=1.0, dgt=0.3): tests if bank helps the original ov_cos-optimal config. Without bank: ar_mar19_014 depth_0=0.4386, ov_cos=0.0537.
7c3a9ad	ar_mar22_001	-12.5	-12.1	-9.6	-7.4	keep	FLOW-SUPERVISED MOTION HEAD: pre-computed OV flow (1.77M files) + motion_warp + memory bank + all improvements. First test with explicit flow supervision for motion head.
4267d79	ar_mar22_002	-12.4	-10.8	-8.2	-8.1	keep	DINO INJECTION + memory bank: DINOv3CLIP features fused into FPN level 0 via learnable projection. Gives decoder access to rich ViT semantics. ar_mar21_014 baseline: depth_0=0.4219.
8279a6f	ar_mar22_003	-12.7	-12.4	-8.2	-7.6	keep	DINO + bank + ov_cos-optimal (df=1.0, dgt=0.3): test DINO injection with ov_cos-optimal config. Previous ov_cos-optimal without DINO: ov_cos=0.0594.
38c714a	ar_mar22_004	-9.4	-12.1	-7.0	-5.9	keep	MULTI-LEVEL DINO injection (all FPN levels) + bank + ov_cos-optimal. ar_mar22_003 (level 0 only): depth_0=0.4188. Multi-level: ?
82ab1b9	ar_mar22_005	-9.3	-13.9	-7.0	-6.4	keep	DINO + bank + 16K + ov_cos-optimal: combine DINO injection with 16K Gaussians. Previous 16K best: depth_0=0.4196. With DINO: ?
9bfbaf1	ar_mar22_006	+0.0	+0.0	-6.5	+0.0	keep	OPACITY ENTROPY (0.1) + DINO + bank + 16K: binary opacity regularization for crisper Gaussians. ar_mar22_005 baseline: depth_0=0.4166.
64180a5	ar_mar22_007	-8.5	-14.9	-7.0	-5.4	keep	SCALE REG (0.1) + DINO + bank + 16K: penalize large Gaussian scales for crisper depth. ar_mar22_005 baseline: depth_0=0.4166.
cc78374	ar_mar22_008	-6.2	-19.9	-16.5	-3.3	keep	UNFREEZE ALL BACKBONE (frozen_stages=0) + DINO + bank + 16K: let backbone adapt to T4 data. Default frozen_stages=1 freezes ResNet layer1.
9ac72c8	ar_mar22_009	-6.6	-19.2	-16.4	-3.9	keep	UNFROZEN + depth-boost (df=1.2, dgt=0.4) + DINO + bank + 16K: combine unfreezing with stronger depth supervision to recover depth_0 while keeping good ov_cos.
065315a	ar_mar22_010	-5.7	-21.3	-16.5	-2.5	keep	UNFROZEN + ov_cos=9.0: push ov_cos lower with unfrozen backbone. Previous best ov_cos=0.0536 with ov_cos=7.0.
997c50f	ar_mar22_011	-8.4	-20.4	-16.5	-3.9	keep	CROSS-STAGE CONSISTENCY (0.5) + DINO + bank + 16K: regularize progressive refinement. L1 between consecutive stage depth maps. ar_mar22_005 baseline: depth_0=0.4166.
99384ea	ar_mar22_012	-8.3	-20.2	-16.5	-3.7	keep	UNFROZEN + STAGE CONSISTENCY + DINO + bank + 16K: combine both ov_cos boosters. Best ov_cos was 0.0522 (unfrozen+ov9). Can consistency push it further?
972eb1e	ar_mar22_013	-14.1	-34.6	-16.8	+3.8	keep	EMBED_DIMS=384 (50% larger decoder): more capacity for the decoder. Most decoder weights reinit from random due to shape mismatch. Backbone+FPN weights still loaded.
edeeb67	ar_mar22_014	-6.0	-20.5	-16.5	-3.3	keep	POSITION-CONDITIONED OV + DINO + bank + 16K: 3D position encoding added to OV head input. Zero-init (safe). Hypothesis: spatial context helps OV quality.
8f34ea0	ar_mar22_015	-6.6	-21.0	-16.5	-3.4	keep	POS-OV + UNFROZEN + DINO + bank + 16K: combine two ov_cos boosters (position conditioning + unfrozen backbone). Best individual ov_cos: 0.0522 (unfrozen+ov9), 0.0536 (unfrozen), 0.0538 (pos-OV).
f9586ae	ar_mar22_016	-5.4	-21.8	-16.5	-3.1	keep	POS-OV + UNFROZEN + ov_cos=9.0: maximum ov_cos push. Best ov_cos so far: 0.0522 (unfrozen+ov9 without pos-OV). With pos-OV: ?
fef64f9	ar_mar22_017	-6.8	-19.8	-16.4	-4.5	keep	POS-OV + DINO + bank + 16K + depth-boost (df=1.2, dgt=0.4): combine position-conditioned OV with depth-focused config. Best depth_0 was 0.4166.
aa8507e	ar_mar22_018	-6.3	-20.1	-16.5	-3.2	keep	GAUSSIAN SELF-ATTENTION + DINO + bank + 16K: TransformerEncoder at finest layer lets Gaussians communicate. Gated (safe init). ar_mar22_005 baseline: depth_0=0.4166.
9fd47f9	ar_mar22_019	-7.4	-20.4	-16.5	-3.4	keep	ALL INNOVATIONS COMBINED: unfrozen+posOV+selfAttn+DINO+bank+stageConsistency+16K. The ULTIMATE experiment — every working innovation stacked.
b4896d2	ar_mar22_020	-8.9	-29.2	-10.2	+1.5	keep	NUM_POINTS=8 (2x reference points) + DINO + bank + 16K: more spatial info per deformable attention query. Default num_points=4. Shape mismatch → decoder attention layers reinit.
d0b35d5	ar_mar22_021	-8.4	-15.0	-10.4	-6.8	keep	HIGHER RENDER RESOLUTION 224x400 (+40% pixels) + DINO + bank + 16K: finer depth/OV supervision from higher resolution rendering.
c4d06b4	ar_mar22_022	-9.1	-13.8	-10.3	-7.0	keep	HIGH-RES 224x400 + depth-boost + DINO + bank + 16K: maximize depth_gt quality. Previous high-res: depth_gt=1.7177. With depth-boost: ?
6b95c1a	ar_mar22_023	-7.7	-15.4	-9.1	-5.9	keep	HIGH-RES 224x400 + UNFROZEN + DINO + bank + 16K: combine high resolution with unfrozen backbone for maximum ov_cos at higher res.
b8bac2f	ar_mar22_024	-3.6	-18.8	-5.9	-3.0	keep	aux_depth=0.5+DINO+bank+16K: auxiliary depth head doesn't help (depth_0=0.4275 vs baseline 0.4166). Trivial self-supervision.
5e801fb	ar_mar25_001	-3.5	-19.1	-5.9	-3.4	keep	Baseline with W&B logging: DINO+bank+16K. depth_0=0.4285 ov_cos=0.0538. W&B migration doesn't affect model quality.
